{
  "contract_version": "v1",
  "job_id": "job_fixture_pypi_setup",
  "analysis_type": "snapshot",
  "subject": {
    "ecosystem": "pypi",
    "package_name": "fixture",
    "version": "1.0.0",
    "artifact_id": "art_pypi_setup",
    "snapshot_id": "snap_pypi_setup"
  },
  "artifacts": {
    "to": {
      "artifact_id": "art_pypi_setup",
      "sha256": "bbbbbbbbbbbbbbbbbbbbbbbbbbbbbbbbbbbbbbbbbbbbbbbbbbbbbbbbbbbbbbbb",
      "filename": "fixture-1.0.0.tar.gz",
      "size_bytes": 1024,
      "snapshot_path": "pypi/setup_exec_suspicious/snapshot"
    }
  },
  "snapshot_refs": {
    "to": {
      "snapshot_id": "snap_pypi_setup",
      "root": "__FIXTURE_ROOT__/pypi/setup_exec_suspicious/snapshot",
      "manifest_path": "__FIXTURE_ROOT__/pypi/setup_exec_suspicious/snapshot/manifest.json"
    }
  },
  "options": {
    "enabled_rules": ["pypi.setup.exec_call"],
    "disabled_rules": [],
    "max_file_bytes": 65536,
    "max_findings_per_rule": 100,
    "allow_binary_packages": [],
    "allowed_binary_paths": [],
    "high_entropy_min_length": 512,
    "high_entropy_threshold": 7.2,
    "fail_fast": false
  }
}
